{
 "$schema": "../../../../schemas/content-pages.schema.json",
 "header": {
  "eyebrow": "{{nameHe}} · {{dayHe}}"
 },
 "countdown": {
  "days": "עוד <b>{{days}}</b> ימים לבחירות",
  "tomorrow": "<b>מחר</b> בחירות",
  "today": "<b>היום</b> בחירות",
  "after": "הבחירות התקיימו ב-{{electionDate}}"
 },
 "afterBanner": "הבחירות כבר התקיימו. הנתונים בכלי נכונים ל-{{quizAsof}} ולא עודכנו מאז.",
 "footer": [
  "כלי עזר אזרחי ובלתי תלוי. הוא לא ממליץ למי להצביע ואינו קשור לאף מפלגה. עמדות המפלגות נלקחו מהמאגר \"{{sourceName}}\" של {{sourceAuthor}}, נכון ל-{{quizAsof}}, ולכל ערך יש קישור לראיה. לשונית \"בונים קואליציה\" נשענת על אותו מאגר, נכון ל-{{coalAsof}}. המאגר מסמן את ערכי העמדה כניתוח שלו ולא כעובדה. ניסוח ההיגדים כאן הוא שלנו, והניסוח המקורי מקושר מכל היגד.",
  "התשובות שלך נשמרות רק בדפדפן שלך ולא נשלחות לשום מקום. גרסה {{siteVersion}} · {{buildDate}}"
 ],
 "matrix": {
  "intro": "בכל תא שני ערכים: <b>א</b> הוא מה שהרשימה אמרה ו<b>ע</b> הוא מה שעשתה. הסולם מ-2- (נגד ההיגד) עד 2+ (בעד ההיגד). לחיצה על ערך פותחת את הראיה במאגר. מסגרת מנוקדת מסמנת ראיה חלשה. כשאין ערך, התא מציין את הסיבה לפי המאגר: \"לא נבחן\" (הנושא לא עמד להצבעה או להחלטה), \"חדשה\" (רשימה חדשה בלי רקורד), \"לא חל\" (יש רקורד, אבל הוא לא נופל על הסולם, או שהשאלה לא חלה על הרשימה) או \"?\" (חיפשו ולא נמצאה עמדה). ראיה שהמאגר מדרג בביטחון נמוך מסומנת במסגרת מנוקדת. אפשר לגלול את הטבלה הצידה.",
  "caption": "עמדות {{listCount}} הרשימות ב-{{questionCount}} היגדים, לפי המאגר \"{{sourceName}}\""
 },
 "parties": {
  "banNotice": "<b>תקופת איסור פרסום סקרים.</b> הסקרים בעמוד הזה פורסמו לפני {{banFrom}}. הם אינם עדכניים, ואין ללמוד מהם על דפוסי הצבעה או עמדות של הציבור היום.",
  "seatsBanSuffix": " (פורסם לפני תקופת איסור הפרסום, אינו עדכני)",
  "intro": "הרשימות מסודרות לפי חציון הסקרים במאגר \"מה אמרו, ומה עשו\" (בתי הסקרים מ-8 עד 14.10). לכל רשימה מופיעים האותיות בפתק, המועמדים הראשונים, הסקרים, המצע ונתוני ההתנהלות שהמאגר תיעד. קישורי המצעים נפתחו ונבדקו ב-15.10.2026, למעט אתר כחול לבן שחוסם גישה אוטומטית.",
  "platformsNote": "<b>על המצעים:</b> ל-{{noPlatform}} מתוך {{listCount}} הרשימות לא מצאתי מצע לבחירות 2026, ולחלק מהאחרות יש רק עמוד עקרונות או תוכנית חלקית. המקורות לא תמיד מסכימים מה נחשב מצע: המכון הישראלי לדמוקרטיה מקשר לעמוד באתר הליכוד, ואילו המאגר, FUNDER ו-handled.team קובעים שהליכוד לא פרסם מצע.",
  "conductNote": "<b>איך לקרוא את נתוני ההתנהלות:</b> המאגר סופר שלושה סוגי אירועים: אמירות שקריות שגוף בדיקת עובדות או מסמך רשמי סתר, תקיפות אישיות על רקע אישי, עדתי, מגדרי או דתי, וייחוס מעשה נסתר בלי ראיה (קונספירציה). ביקורת חריפה על מדיניות לא נספרת, וגם לא מקרים גבוליים. הספירה כוללת את הקמפיין הנוכחי ואת הכנסת ה-25. המאגר מדגיש שהיא תלויה גם בכמה אנשים ברשימה תועדו ובכמה הם מתבטאים, ושרשימה בלי אירועים אינה בהכרח נקייה. \"האשמה\" בעמודת ההליכים היא טענה שפורסמה, לא הליך פלילי, וחקירה או כתב אישום אינם הרשעה. הנתונים האלה לא נכנסים לחישוב ההתאמה.",
  "footer": "בבחירות מתמודדות {{allListsCount}} רשימות. הכלי כולל את {{listCount}} הרשימות שמופיעות במאגר \"{{sourceName}}\". את כל {{allListsCount}} הרשימות אפשר לראות <a href=\"{{allListsUrl}}\" target=\"_blank\" rel=\"noopener\">ברשימה שאישרה ועדת הבחירות</a>."
 },
 "tools": {
  "eyebrow": "כלים נוספים · נבדק ב-15.10.2026",
  "intro": "כל שאלון משקף החלטות של מי שבנה אותו: אילו שאלות לשאול, איך לנסח אותן ואיך לשקלל. כשכמה כלים שונים מגיעים לתוצאה דומה, אפשר לסמוך עליה יותר.",
  "note": "<b>כלים נוספים, עם הסתייגויות:</b> סרוגים (13 שאלות ו-16 רשימות; לפי האתר, חלק מעמדות הרשימות החדשות הן הערכה, וההשתייכות המגזרית מקבלת משקל נוסף), ישראל היום (14 שאלות; לא מצאתי פירוט של השיטה), פולימטר (10 שאלות; התשובות נשמרות עם מזהה פסאודונימי), הקלפי (15 שאלות ו-14 רשימות; לא מצוין מי מפעיל אותו), המצפן hamatzpen.life (10 שאלות ו-13 רשימות; האתר מציין שהניקוד אינו מדעי), knesset2026.com (לעולים, בכמה שפות; לא הצלחתי לקרוא את השאלון עצמו).",
  "footer": "הפרטים על הכלים נבדקו באתרים עצמם ב-15.10.2026. לא מצאתי כלי התאמה לבחירות 2026 מטעם המכון הישראלי לדמוקרטיה או מטעם כאן, ynet, הארץ או N12."
 },
 "decide": {
  "items": [
   "<b>להגדיר קווים אדומים לפני שמסתכלים על התוצאה.</b> אחרי שרואים אותה, קל להצדיק את מה שכבר רוצים.",
   "<b>להשוות בין \"מה שאמרו\" לבין \"מה שעשו\".</b> אם רשימה קרובה אליך רק לפי ההצהרות, כדאי לבדוק את הפער בראיות.",
   "<b>למלא לפחות שני שאלונים שונים.</b> אם התוצאות שונות מאוד, כנראה שהניסוח והשקלול הם שמכריעים ולא העמדות שלך.",
   "<b>לקרוא את הטיעון החזק של הצד השני</b> בנושא אחד לפחות שחשוב לך.",
   "<b>לבדוק עם מי הרשימה מוכנה לשבת.</b> מה שרשימה תוכל לבצע תלוי בשותפים שלה בקואליציה.",
   "<b>לשים לב לאחוז החסימה.</b> רשימה שמקבלת פחות מ-{{thresholdPct}}% מהקולות לא נכנסת לכנסת. סקרים יכולים לטעות, ומסוף יום שישי 23.10 אסור לפרסם סקרים חדשים.",
   "<b>לגוון מקורות.</b> הפיד ברשתות מציג בעיקר תוכן שדומה למה שכבר צפו בו. כדאי לחפש מקורות מכמה צדדים.",
   "<b>להחליט מה מכריע עבורך:</b> העמדות, ראש הרשימה או הגוש. אין תשובה נכונה אחת, אבל כדאי לדעת מה חשוב לך."
  ],
  "electionDay": "<b>יום הבחירות:</b> {{dayHe}}, יום שבתון. את מקום הקלפי אפשר לבדוק ב<a href=\"{{lookupUrl}}\" target=\"_blank\" rel=\"noopener\">שירות \"מודיעין בחירות\" של משרד הפנים</a> (gov.il), בטלפון {{phones}}, או ב-SMS ו-WhatsApp למספר {{sms}}, בכל שעה. לפי השירות, הנתונים נכונים לפנקס הבוחרים שנסגר ב-{{registerClosed}}. כדאי להזין תעודת זהות רק באתר שכתובתו ב-gov.il. להצבעה מביאים תעודת זהות, דרכון ישראלי בתוקף או רישיון נהיגה בתוקף עם תמונה."
 }
}